1949	两个多小时都没送过来,联系百度退单了,下次不会再订了	0
1950	狗屎餐厅，送餐3个小时，还没咖啡，一杯咖啡送了3天，客服电话打了6个以上，餐厅电话一个没打通，老板什么态度，一杯咖啡就不给送了，住店家早些倒闭，谢谢。	0
1951	送餐很快～师傅很好～面也好吃	1
1952	量越来越少了。	0
1953	一般，煎饼更适合现做现吃吧	1
1954	味道很好,皮薄有汤汁	1
1955	太慢了太慢了太慢了，饿死了，味道还行！	0
1956	送来时都坨了,没一点汤了	0
1957	140分钟才送到，饼也不好吃，也没有酱，干死了	0
1958	根本没有看我的要求	0
1959	米条全是洋葱。。。	0
1960	牛肉特别少，为什么啊	0
1961	配送时间真无法保证	0
1962	不好吃,都凉了,汤顶上一层大油,送餐时间1个半小时,米饭是夹生的,最难吃的料理,以后再也不定他家了,直接扔了	0
1963	这个卷饼的套餐配的很好，没有粥来冲淡一下的话，就又甜又咸又腻	1
1964	送餐2个半小时,而且这个米线根本不值28,太不值了	0
1965	上次订的葡萄汁，结果送来的是苹果汁，心想商家也不容易，难免会搞错，这会送来的石榴汁都洒了，里面掺了很多水，一点都不纯	0
1966	好难吃，什么味都没有，还被店摆了个乌龙。。	0
1967	送的倒是挺快的，只是汉堡做那么小好意思吗？	0
1968	有了百度外卖以后更好了，要不然这么晚了都吃不到，老顾客了，味道不错，推荐！	1
1969	油太多了。服务态度好。	0
1970	菜单上的东西，实物都没有，很想知道为什么。而且全是豆皮，差评，快递很快	0
1971	态度好，人热情，没电梯爬楼送来的。	1
1972	我吃过最差的一次冬瓜汤！里面就俩片羊肉卷！没有味道！跟在店里吃的差太多了！锅包肉确实不酥了没办法外面么，但是那个冬瓜汤也太难吃了！	0
1973	里面有大块鸡肉和一点生菜，个人感觉不好吃，有点失望啊，饼挺大，不松软	0
1974	2个小时送到的，气都不想生了，自己看着办吧	0
1975	菜品一直都很美味。百度外卖的送餐师傅们真辛苦，每次送餐还都不忘说一句:祝您用餐愉快。必须给个大大的赞啊！百度外卖会越来越好的(^_^)	1
1976	要的菠萝咕咾肉给的不到一盒，非常少，连一块菠萝都没看见	0
1977	饭菜很可口，就是大拌菜很难吃，第一次送来时，大拌菜你什么都没有，然后送餐的又给送了一次调料，拌好以后特别难吃，调料里酱油太多了，根本没法吃。	0
1978	米饭是剩的，热过之后很难吃，真垃圾，这么大的店	0
1979	居然里边有空饺子！里边没馅！配送的很快。	0
1980	服务态度非常恶劣，生了一肚子气，一个大老爷们儿跟个娘们似的。	0
1981	非常快～辛苦了～很好喝	1
1982	太慢了送的，服务态度还是不错，不过速度实在不能忍受，不会在订了	0
1983	味道很好，服务很快，值得拥有	1
1984	真的很差，送餐时间足足晚了1个小时，还不让取消订单，霸王条款呀。	0
1985	不错，第一次订外卖，怕送迟了，特意订11点的，结果十点多就到了，这下放心了，以后订12点的时间！,强烈要求老板给送外卖的大哥加薪，外卖大哥真不错，真心好！下次还来	1
1986	点炒菜居然没有米饭，还送了一个半多小时也是醉了	0
1987	送餐速度还行。味道惨不忍睹，就怕菜的味道太淡，特意点了宫保鸡丁，这居然都能做的那么淡，不咸不辣有点腥。以后估计不会点小渝府的外卖了。	0
1988	快递员的服务态度特别好，还主动问有没有垃圾帮您带下去。真心不错。	1
1989	送餐送的很快，比预计的还早，不错不错	1
1990	送的很及时，好评。。	1
1991	挺好吃的,就是太慢太慢了！！(*>.<*),两个半小时！	0
1992	咖喱鸡肉！饭菜全部洒在袋子里恶心到极点，卖家半小时做好饭菜，送餐用时1个多小时还超时20分钟	0
1993	不是一般的慢等了两个多小时，冷面已经成一坨了，夹着一根面整碗都能提起来…	0
1994	一个半小时才送到太慢了	0
1995	一点也不好吃，而且还小	0
1996	等了2个小时没送来，上班了才送来，退款很慢	0
1997	去过店里吃，味道非常好。但外卖的质量，和店里似乎就不是一种东西……,点的咖喱皇海鲜，咖喱水水的，一点也不浓稠，也不香。海鲜，主料是蟹肉棒（人造那种）有一个青口，2，3个并不新鲜的极小的虾仁。,很失望很失望！	0
1998	送餐员也太厉害了，就问了句到的是不是六层怎么都不回答，之后还嚷嚷，拿了餐还在我公司门口嚷嚷。起码的尊重都没有还在给顾客这样的服务真是砸招牌	0
1999	两个小时才送来，卷饼味道还行，粥还不如早点摊的，没有皮蛋没有瘦肉，粥也没味道。冲着卷饼给两星吧。	0
2000	太不好吃了	0
2001	饭送来全撒在外面了，一点都不想吃了	0
2002	汤和面不是分开的，面都糊了，不好吃。	0
2003	宫保鸡丁,鸡丁太干,花生不脆,口感不好,重庆辣子鸡,无香辣味	0
2004	这次外卖吃的很不满意，本来定的饭说是没有了，让我换一个，还说什么不好意思包装费就不要了，最后还是原价给的钱，然后要的两个汤都洒了，一口没喝到，最不愉快的一次经历	0
2005	送的太慢了。。再晚来一会我都准备退单了。。。慢的无与伦比啊	0
2006	送餐太久了！	0
2007	抄手很难吃，慎点，巧手大拌菜推荐，真的不错	1
2008	最差的一次点餐！七点钟点的餐，九点才送到。煎饼都塌了，红油抄手简直就是红油速冻水饺！再不点黄太吉了	0
2009	把上次少送的给补上了，还给了小惊喜，很上心。	1
2010	太他妈的慢了，早餐送过来吃成了中午饭，真够可以的	0
2011	鸡肉是生的菜都炒不熟，还干开饭馆，太奇葩了，太恶心	0
2012	116分钟才送到，醉了	0
2013	没有糖包，热巧克力要了只有一半	0
2014	饭真的很一般,米饭质量不行	0
2015	就是送餐好慢	1
2016	粥里面都是虫子,一碗粥里面找出五只虫子，给店方打电话还说不可能,，我有照片！！！	0
2017	味道一般！而且等了一个多小时。	0
2018	餐还没有到，到底给不给送了	0
2019	送餐小哥帅气，态度好，菜品新鲜，扫光光喽!	1
2020	快递哥雨天送外卖很辛苦。麻辣烫一般，	0
2021	咖啡星冰乐分明点的是瓶装的，但是送来是塑料装的	0
2022	这大下雪天的百度骑士非常好非常快的送来了，必须好评大赞	1
2023	配送员的速度超快，本来预计10:45到的，10:25就送到了！！非常满意	1
2024	以前很喜欢吃，现在送来的是什么鬼？咖喱鸡肉烩面，为什么没有咖喱？？？	0
2025	披萨和菠萝派不错。还可以吧	1
2026	东西真是太垃圾了，那咖啡都没法喝了，	0
2027	拿到手的时候是凉的，感觉一点儿都不好吃。就是山东的煎饼，卷上煮熟的肉。	0
2028	鲜花饼没给！！！	0
2029	相信哥，订外卖一年多了，菜量那叫个少，干锅肥肠38元，三分之一盒，敢再黑点吗？大家看着办吧，送外卖的再好和菜没半毛关系	0
2030	还是不错的	1
2031	冷了,有点硬	0
2032	妈的。饭都没给我送来，就默认交易成功了。什么玩意	0
2033	饼巨好吃，就是有点吃不太饱。。。。	1
2034	味道不错，就是送晚了半个多小时	1
2035	饼很大，但是速度很慢	1
2036	送药小哥态度很差,很不耐烦,怀疑是老板送的货,你们能别让老板干这活么？？	0
2037	承诺十二点五分送到，结果十二点四十刚刚送到。。。送不到就不要承诺时间。。。	0
2038	这次我也要勺子了，也没有给勺子。	0
2039	麻烦下次送餐能不能确认好再给？自己送错了反倒麻烦我楼上楼下来回跑好几趟，我点的多就应该送错是么？神马鬼理论，1分都不想给	0
2040	真是把宇宙都卷包没了	0
2041	要的柠檬茶给我弄成银耳汤，还全撒所料带里了，怎么喝	0
2042	为什么里面的饮料没有图片上有，送达没有，而且还贵了2块钱！	0
2043	慢的要命，再也不吃了	0
2044	这次的粥一碗太咸啦，另一碗没放盐。。明明买的都是皮蛋粥的说	1
2045	明明备注了把茄子肉末面改成茄子肉末饭的，但送过来的还是面，都成一团了，根本没法吃了，其他的还可以	0
2046	太慢了！！！！晚上还不错,中午不要点！	0
2047	都洒了，不单小菜洒了，饭也弄得乱七八糟的，而且等了一个半小时！	0
2048	今天这个貌似不是很新鲜,而且送的有点慢,从订到送用了1个小时,昨天用40分钟,橙汁洒出来不少	1
2049	1:52下订单，四点半都没有送到。真是太无语了。外送的人说撒在路上了	0
2050	第一次尝试，不好吃，没有鳕鱼好吃	0
2051	我要的热豆浆到了都凉了,想让我拉肚子吗？	0
2052	送餐快,态度也特别好,辛苦啦谢谢	1
2053	石锅拌饭必须用石锅吃,其它的饭也必须趁热,外卖送过来很难吃	0
2054	虽然等了一个多小时，但确实因为天气热，外卖小哥送不过来，辛苦辛苦，好评	1
2055	饼好硬好厚，肉柴菜少，没什么味，比老北京鸡肉卷差太多了，吃一次不会再吃了。粥太咸	0
2056	这次订单为啥有上次订单的备注消息？	1
2057	我觉得简直就是个坑，180的菜，我气死，够二个人吃	0
2058	牛肉太硬了嚼不动啊	0
2059	一单元和二单元分不清...麻烦	0
2060	适饭量小的	0
2061	都冷掉了,皮都軟掉了,可能還是得去店裡吃	0
2062	一如既往。不错哦。！！！！	1
2063	配送简直慢死了！！！！	0
2064	太慢了。送了一个多小时，而且点的是银耳汤，结果送来是雪碧…	0
2065	木耳非常难吃	0
2066	一个半小时？拌面根本不能吃了！完全变成一坨的了。蟹黄蒸蛋也少的可怜～从来没遇到过这么差的外卖	0
2067	炒的跟以前的味不一样，太咸	0
2068	我记得我是选择下午4点半送的，结果不知道为什么变成了1点多就送到了。鱼香肉丝盖饭好吃，皮蛋粥也好吃，赞赞	1
2069	粥做的根本没法吃。	0
2070	非常满意，送餐员态度很好	1
2071	油特多，菜都是剩的还有点发酸，节省成本也不能这么省吧。。。以后再也不点了。	0
2072	喜欢吃包菜粉丝卷！豆浆也很好！	1
2073	饭送的太慢了！	0
2074	速度非常快，很好很好	1
2075	慢死了，气死了	0
2076	我以为付款那个留言备注就是摆摆样子呢，即使不摆样子，餐厅备菜人员也不会在意！于是在备注栏里颤颤巍巍地提了自己不喝可乐，已经存了好几杯黄太吉的软软了，不知道软软能否换成豆浆？确认，发送！结果，果真见证奇迹的时刻发生了！是豆浆，没错的！送来的是豆浆！以至于我激动得忍着饿冒着随时饿昏的危险非要在吃前来评论！	1
2077	皮蛋瘦肉粥不错，土豆肉丝盖饭就呵呵了	0
2078	百度外卖速度快，态度好。	1
2079	经济实惠，家常风味的大饺子	1
2080	点错了！还没到	0
2081	太慢了,一个多小时才送来,差点耽误事	0
2082	首选是得吐槽一下这家的速度,一个半小时起,然后卷饼包装很不错,酱香鸡肉的比较赞,飘香肘子一般般,只是店家,我强调那么半天一点辣都不要,素卷里还是辣的,先吃了一口觉得你家酱汁太稀,味道淡,然后就直接吃到了红红的辣椒,我刚手术完几天不能吃辣啊,今天注定又是难熬的一天	0
2083	点了5串羊肉串，量少的可怜。和在店里吃的不一样	0
2084	大份的超级大，里面好多大肉块	1
2085	肥肉太多吃的时候还把嘴唇拿破了	0
2086	送餐挺快，但是不好吃，菜很少，全靠饭撑着，宁可不要那个装B的牛皮纸袋，菜多一点	0
2087	没想象的好，粥里没硬货，饼味道还行，量一般	0
2088	很好！很实惠！	0
2089	送餐太慢了，又是90分钟	0
2090	今天定的这个纯素的口味不太好，里头放了豆瓣酱还是什么的太浓了，有点发苦。。送餐时间太长，一共用了1个半小时多。皮蛋粥还不错。	0
2091	红油抄手贵，但味道确实不错	1
2092	没给吸管,怎么喝奶茶	0
2093	我定的是素三鲜的，打电话让我换，换的是香菇的，本来六个，但是只送了三个。为什么？	0
2094	红烧鲫鱼简直无法直视，32块钱两条小小鱼，还没鱼缸里的锦鲤大呢，鱼肉非常少，薄薄的一层，鱼刺超级多，不说了，满满都是泪…	0
2095	没啥烹饪技术，不太好吃。。。是辣的，也没提示。。。营销做得好并没用。。。	0
2096	肥肉太多...	0
2097	披萨送到后变成煎饼果子了，包装根本不适合送餐！！！	0
2098	送了俩小时！	0
2099	锅贴里葱太多了	0
2100	卷饼铝箔把嘴唇划破了，郁闷	0
2101	超过90分钟餐才送到，太慢了，催了多次，说门店联系我，也不联系。万幸，饭菜还是热的，还可以。	0
2102	乌鸡汤一块鸡肉都木有！！！！！	0
2103	送餐时间太慢，送餐人员想让消费者从19层楼下一楼自取，服务态度欠缺	0
2104	一般吧，真心不辣，速度不错，口味一般。	0
2105	等了2小时，送来是凉的，特别难吃还，无语了	0
2106	早送到了，忘记点确认了，对不起小哥和店家	1
2107	为什么最近我总是下完单就退款，说我优惠金额已用，明明是今天第一次下单	0
2108	下单一个小时！！！还没有人接单！！！！！！！！而且取消订单非得要打电话！！！！什么傻逼规矩！！！！！！！！！！！！！！	0
2109	快递很好。穿心莲一半都是坏的！一半绿，一半是烂菜叶子的黄色，没法吃！再也不在这里定外卖了！伤心！	0
2110	太太慢了，	0
2111	卷饼好吃，送货也很快，非常好，非常喜欢的一家店	1
2112	没吃过这么难吃的水煮牛肉，刚送来吃一口就扔了。有股膻味	0
2113	味道很差，饭很油	0
2114	可能天热放坏了，吃完晚上拉肚子了。卖相也没有店里的好。	0
2115	呵呵，20块钱的卷饼，里面就3小块牛肉，剩下全是土豆丝，有你们家这么卖东西的吗？肯德基都没你们家坑！	0
2116	外卖员很差外卖员很差外卖员很差	0
2117	眉州东坡，真心不错	1
2118	很不好吃~四十多块钱的红烧肉，这么贵一份一点品质都没有~~看起来脏脏的，很难吃~~	0
2119	送餐师傅很好呦！饮料好大杯！吓死宝宝了！	1
2120	送的超级快，我收到还是滚烫的	1
2121	味道不错速度快	1
2122	时间有点长送餐，菜还可以，饭量少而且有点儿硬	0
2123	一个，送的太慢了。。。。	0
2124	饼味道一般吧，很少的一碗粥。	1
2125	配送能不能快点呢？	0
2126	送餐小哥赞一个！！！辛苦了	1
2127	50块买了碗汤和两坨米线，呵呵这钱也是好赚，知道为什么评价这么低了	0
2128	快递小哥辛苦	1
2129	13元的煎饼口味也不是很特别，送餐85分钟，距离1公里，不知道这服务以后怎么做外卖	0
2130	商家态度差,，送来的餐品全洒了	0
2131	送餐越来越快啦！	1
2132	说好不要蒜的，结果两次都有蒜，简直太过分了！！！~~~以后不准备买了，有也不通知一下。	1
2133	第一，送来时候已经凉了。第二，青椒鸡丁完全没熟啊。炒时间太短了。	0
2134	送错了还不给换，垃圾！	0
2135	希望大卷的饼能厚一点～因为饼皮太薄内容太多了的话会包不住啊、而且感觉只在吃菜没有饼《	1
2136	百度骑士太给力了	0
2137	果汁非常好喝，新鲜！瓶身上贴的书籍护封很有趣，“博大的意思包含：大家都很美丽啊”	1
2138	送了两个多小时,连个解释都没有,还是我打电话过去问的,醉了	0
2139	橙子有一个直接是干的没任何水份了！香蕉里面黑了一根！	0
2140	速度挺快，东西很不错	1
2141	宇宙卷饼辜负了“宇宙”的大名。饼难吃，肉不香。店家在没有任何告知下，更改订单内容，这种做法实在不妥，事后还找各种借口为自己的错误行为辩护。不会再光顾。	0
2142	送餐人员很给力，直接送到门口	1
2143	粥的味道还不错,饭也不错,拿纸袋装感觉好有B格,下次还会来的	1
2144	确定再也不会从网上订餐了	0
2145	要了两个煎蛋，只放了一个。。。不过拌饭味道不错。	0
2146	味道很像必胜客的味道，外送也很专业	1
2147	送的太早了	1
2148	不错哦，感谢百度骑士！	1
2149	特别特别好，外面马上就要下雨，小哥快马加鞭的来了～～神速～^_^	1
2150	简直不能更糟糕！！！汤汁流得到处都是，并且图片与实物差太多！纯素卷里根本没有绿色蔬菜	0
2151	煎饼味道不错，豆腐脑也很赞	1
2152	黑三剁炒饭就一丁丁辣椒，一丁丁鸡蛋，一丁丁酱油，5块钱不能再多了，太坑了！！！！！强烈抗议！！！！	0
2153	味道一般，图片显示好多菜，其实菜不多，大部分都是洋葱，有点失望。	0
2154	要求不加辣酱，竟然就一点味道都没有啦	0
2155	感觉太油了	1
2156	送餐小哥服务很好，大虾也很好吃	1
2157	东西很好吃，送餐速度也非常快，只是窝蛋牛肉饭上边写带汤，可是没给~~不知道是不是忘记了~	1
2158	强烈不推荐回锅肉盖饭！！！真的太难吃了！！！全是大肥肉！！！不能再肥了！！！	0
2159	等了1个半小时，送餐员态度极差！	0
2160	广味烤肠漏送了！	0
2161	呵呵了个呵呵，+1r，不开心。	0
2162	相较于平时略慢并且可能是由于在高峰期的原因肉比较凉饭没有浇汤汁海带丝也比平时少这并不是我的错觉因为我每次都吃这两样.....宫保据说也比上次的差一些所以我决定下次避开高峰期	0
2163	面坨了。,口感不好。调味也很一般。蔬菜发苦。只有红油猪耳差强人意。	0
2164	煎饼很好吃！送餐很快！	1
2165	1谁家干锅土豆片放肉？你们厨师在他么蓝翔还是新东方学的？懂不懂常识？,2,、1小时45分钟的送餐时间谁受得了？你们是请乌龟给送的餐吗？	0
2166	没想到是熏肉，不太喜欢	1
2167	鸡肉一点味都没有而且米饭都不能吃了、哎都不知道怎么做的？	0
2168	送餐时间长达两小时。太慢了	0
2169	百度小哥速度超快提前半小时到，非常感谢，这么冷的天真是不容易，再次感谢	1
2170	外卖小哥和店家都很好	1
2171	凉菜量很小，味道不错，感觉不怎么实惠。	0
2172	说了不放辣，还是辣的	0
2173	送餐找错小区，可乐没吸管，还洒了好多，薯条都凉了，还要好评	0
2174	量大，第一次吃到这么充足的卷饼。满意	1
2175	这份量,搞错了吧！！	0
2176	北京大雨，还能提前15分钟送到，煎饼豆浆豆腐脑还是温热的，很好，很感动，会继续回购	1
2177	感觉一般般，不是	0
2178	粥根本没放盐,送餐服务态度差！	0
2179	肉很多，包装很好，味道有点不够重，可以多加点料	1
2180	1点半订的，到了2.47的时候打电话过去说是还在店里，还没做好，这特么是搞毛啊？订单还显示已送达？卧槽，送给谁吃了啊？气死了，两个多小时愣是没见到饭，怕退订竟然私自给提交了，我也是服了。	0
2181	猪蹄上都是猪毛，我都怀疑其他东西干净不！	0
2182	最爱挚爱马铃薯披萨，超好吃	1
2183	真的是太好吃了太帅了吃的我美美的送餐也很快以后外卖就百度这家餐厅了	1
2184	送来都凉溫了！！！	0
2185	送的太快了	1
2186	鸡块难吃,速度太慢,花了一个多小时,送到饭都凉了怎么吃	0
2187	送错了东西还有理了啊～错了就是错了，打电话告诉你们，你们道个歉就完了，女的接的电话不道歉态度特别恶略，很还这那那这的～实在是太恶心了！！！！！！	0
2188	21的至尊肥牛套餐,居然连饮料都没有,着实被图片坑伤	0
2189	时间太长，而且咖啡洒了一半	0
2190	没有准时送准确地点！！！送餐人员服务态度很差！	0
2191	时间太长，等了一个半小时，外卖都漏了，全是油	0
2192	大下雨天送来的,辛苦了	1
2193	煎饼果子放沙拉，真是享受不了	0
2194	关东煮送来汤都颠簸没有了。外送了很多次和合谷就这次不好	0
2195	有点咸了其他不错	0
2196	果真是大馅饺子，味道很棒啊！	1
2197	店家给力，骑士哥们也给力，辛苦了谢谢，，下次还点。	1
2198	味道还不错，比想象中小......感觉不是很值	1
2199	非常划算又好吃	1
2200	送餐员很礼貌，很快！好评	1
2201	送餐太慢了，生煎包和皮蛋粥都好难吃，以后还是选择别的吧	0
2202	食物不错，就是服务太差，点了这么多回就这次很不爽，小菜没有盒子包装还收包装费？！说了提供餐具却没有筷子没有勺子！！！送菜的不认识路竟然要我下去接他1我勒个去！！！无奈	0
2203	又没加浓缩，备注里面写的很清楚，为什么十次有八次都没加浓缩！！！百度外卖真的服务这么差吗？是星巴克问题还是百度外卖问题？？？	0
2204	我要的米线,全都给做的土豆粉,很不满意,对配送比较满意。	0
2205	还可以，经常订，省事	1
2206	好好好！！！	1
2207	八点半下的早餐订单，10:50才送到！！还让不让人吃早餐了？！体验过慢的，没有体验过这么慢的配送服务！	0
2208	单子打错了，少送了。	0
2209	都是肉,有些干,肉真的很多,多一些汤汁就好了,味道还不错,还送了个速溶咖啡	1
2210	态度太差！	0
2211	平时都很好、可是这次确实剩饭、一粒一粒的、像用水泡过、让我非常不满意	0
2212	味道不错，但是送餐太慢了，而且说好的延时赔偿呢？	0
2213	味道还不错，性价比较高	1
2214	一个小时30分钟才送到，都凉了，味道很一般，再也不订了。	0
2215	送餐晚不说，打电话没回复，一点沟通都没有，差差差，绝不会再定	0
2216	买的饼和粥！！！粥居然不给送！！没见过这样的！	0
2217	超级恶心，晚了一个小时，商家电话不是正在通话中，就是接通以后无人接听，严重鄙视！！！太无良了	0
2218	速度超级快呀，很好喝，冰爽	1
2219	送外卖的脑残，说好了南门，送到东门，害我等半天等不到人，打电话让他送回东门，居然说找不到，路都分不清你还送啥外卖，更何况你是人，不会问吗？难道你是猪吗？	0
2220	送的超级慢…,薯条都干了,整个俩小时才送到	0
2221	总体送餐时间较快，干炸小黄鱼、梧桐花鸡蛋炒韭菜的味道还可以，只是东边大拉皮是辣的（备注信息我说了不吃辣的），味道也很一般。大花卷个头还挺大，味道一般般。外卖袋子里还多了一个类似的肉馅，味道很不好，不是我要的，比较奇怪。	0
2222	晚了半个小时，全都凉了，我要投诉	0
2223	不错，第二次吃了	1
2224	确定是香菇鸡肉么？感觉是不是弄错了？？？？	0
2225	连双筷子都没有，明明点的葡萄汁结果送来的是酸梅汤，也真是无语了！	0
2226	餐盒漏了,菜油洒了一袋子	1
2227	肉给的太少了吧-_-||	0
2228	慢慢慢,。都想退了。做的倒是还不错	0
2229	不愧是老字号，点心味道就是好吃啊！骑士送货速度很快，为人和善，必须赞一个！	1
2230	皮蛋粥快咸死了，不好吃！不过包装值得表扬！	0
2231	难吃，还贵，明明在线支付了25元，饭到了，单子上却显示支付了18.85元！这是怎么回事？	0
2232	预计11:00到达的餐12:24才到……这样的速度让人之后怎么敢再订！！！！！！	0
2233	准时，好吃～	1
2234	没有辣酱，算什么拌饭	0
2235	太差劲了吧，同一个店，外卖包装居然相差那么多，昨天的饮料是罐装，今天是纸杯，昨天的餐盒是双层保温的，今天就单层，最过分的是，我点的芝士泡菜炒饭，结果只是泡菜炒饭，没看到一点芝士，味道也没有芝士味道，希望给我个能说得过去的理由。	0
2236	又凉又难吃！送餐时间两个小时	0
2237	汤横着就送过来了，撒到处都是!	0
2238	味道依然很好，送餐等了一个半小时…	0
2239	感觉肉已经坏了，有股怪味道	1
2240	很喜欢,家常饭	1
2241	有点肥⋯⋯有点腻,味道还算可以吧	1
2242	好吃,满意	1
2243	真的很难吃	0
2244	还行吧，料比较少，不过看起来包装还是很用心的	0
2245	太慢了！差评！	0
2246	人大写成三义庙不好意思。	1
2247	比萨做的不怎么样，但送餐速度和服务还是非常好的。	0
2248	好极了好极了好极了……	1
2249	荤劲十足牛堡和小皇堡一样小，太小了。。不值。	0
2250	牛肉粥肉有点少,而且盒子到的时候都压扁l	0
2251	提拉米苏很好。咖啡包装不严实，拿到后全洒了，杯底已经漏了。差爆了。	0
2252	差，送餐很快，味道太难吃了	0
2253	还可以，就是米饭偏硬了点	1
2254	煎饼还是得现做现吃，豆腐脑非常好吃！	1
2255	大叔特别面善！饭食用料很好！	1
2256	味道还行，就是送的太慢了，催了3次一个多小时才送来，送来的时候饭都凉透了	0
2257	菜真的很一般，还是店里吃好些	0
