4169	一般,偏贵	0
4170	接线员的服务态度差，都不敢打电话咨询了，其他方面很好	0
4171	送餐送了2小时…电话催了无数次…送来还少了一个…崩溃	0
4172	我的两个中奖瓶盖拿走后就没有下文了，4元可乐居然是灌装的！！！！	0
4173	非常无奈，饭看着就不好吃，还不给筷子。联系配送员配送员不给送，联系商家商家说让我下楼自己买筷子，真逗，说下次再订的时候打折，只能说没有下次了，奇葩餐厅。一星都不想给	0
4174	送的非常快，量足，吃的很饱，灰常不错！	1
4175	两个半小时才送到我也是醉了，等那么就好吃的话也值了，关键味道不咋地，全是肥肉，看着就反胃，不会再来了	0
4176	这红烧肉盖饭原来是红烧茄子盖饭	0
4177	少送了一份海苔汉堡串，打电话给客服也没有解决	0
4178	就是好吃,量还够。速度也快	1
4179	还行，就是吃不饱，下次订大份	1
4180	别的暂不说，打了四五个电话，9点多定的餐2点了早已经上班了才到手里，你可以早点说送不到啊，送到当时真想不要这份饭，都不容易，想想没必要而已，欠一个解释，我想这也是最后一次订了。希望你们也要注意，类似的错误不容发生。	0
4181	米饭和粉条都很硬	0
4182	20-8的活动没了,不厚道。	0
4183	菜品没问题的。也很划算。好像少给了一个豆浆。不过算了。送餐太慢。希望以后加快点。	0
4184	你确定11点10分是你送达,的时间？到12点半才来，菜还撒了，很无语。。。。	0
4185	味道很赞，到家是热滴	1
4186	配送非常快，10分钟就送到啦～	1
4187	鲶鱼不好吃	0
4188	饼太硬，香肠炒饭里的香肠是臭的	0
4189	吃了这么多次九品，今天竟然吃到小强!!!,心情极差，希望店家改善厨房卫生环境!	0
4190	灌汤酥肉套餐,也许是我的味蕾坏了	0
4191	你知道多慢是慢么？多难吃是难吃么？	0
4192	上午下单，下午才送！怎么索赔	0
4193	送餐师傅人不错，不过菜很不好吃，量也不够	0
4194	太慢了,等了1个半小时	0
4195	鸡块是冷的。。	0
4196	宫保鸡丁饭,没啥鸡肉,花生一大堆。	0
4197	丸子汤非常非常小一碗，炒米条也非常非常少，量也太打折扣了	0
4198	味道不错，但是说好的送果汁怎么没送！不诚信啊	0
4199	肝有点味不对了，倒了	0
4200	从地图上看到已经在这个小区了，又转到上一个小区。不过外面夏日炎炎，送餐不容易，总算还是吃到了。	0
4201	盖饭好难吃…粥还可以	0
4202	送来蓝莓少了一盒，西瓜不熟，沟通之后，都有解决	0
4203	卷饼很好吃，量也足。但是咱这送餐速度真不敢恭维。10点40订的，一点才送到，再晚点可以做下午茶了	0
4204	好吃，送餐时间较快，服务态度好，赞。	1
4205	包装好，味道好，很满意。	1
4206	很难吃，饭肯定不是从石锅做好倒出来的，湿乎乎的，应该是直接把蒸米饭和菜给拌了，菜也不新鲜，和在店里吃差别太大了，以后不会再订了，外卖太差了	0
4207	准时，好吃，超级好。	1
4208	两公里送了俩小时	0
4209	请务必给送餐小哥涨工资	1
4210	129分钟送达！	0
4211	很快很快,但是南瓜羹很难喝	1
4212	很差，时间太短了，不好吃，	0
4213	很好，很快，稻香村的东西就是好，百度骑士也很快很棒……	1
4214	唉，备注写上了不要芝士、不要沙拉酱！汉堡王还特么给弄了，单子上不是写了么！看了么！？不过最后赔偿了一个，辛苦了送餐师傅再取、送一趟！师傅人很好，猛猛哒！嘻嘻	0
4215	这个卷的很失败。湿漉漉的，不太方便吃。	0
4216	商家态度差！说了备注忌口，也没按要求。	0
4217	还不错、不过还是喜欢可口可乐	1
4218	送过来迟了快一个小时，凉透了，而且都露汤了，弄的特别脏	0
4219	2:30送到,小伙伴们,看着办吧	0
4220	非常快，态度好。	1
4221	第二次了，没有番茄酱。送错餐也是多次！	0
4222	餐送到楼下需要自取，我还不如下楼吃去。下次不光顾了	0
4223	好极了，超值！！	1
4224	慢，送餐态度我也是醉了	0
4225	我实在不想差评，11点半点餐到1点半吃上饭，中途打电话经历了关机及联系客服以及想取消的时候一直被告知马上到，菜到了已经凉的确实天气不好也阻挡不了心情实在太差	0
4226	速度很快，菜的味道也好！不错！	1
4227	米饭没给我,是不是该把钱退给我？	0
4228	口味不错、速度也够快，就是量少了点。	0
4229	不知道什么味，特难闻，吃一口就都扔了，和包装袋有关系吧，哎	0
4230	两个小时的外卖，我也是服了	0
4231	3:26,我收到了,但3:16,已经完成?,哈哈	0
4232	没有很好吃	0
4233	皮蛋瘦肉粥好像胡椒放多了，有点辣。鱼香肉丝的卷饼味道不错，但是甜味偏重吃多了有点腻，分量很足	1
4234	送的很快，就是不好吃，面里菜太少了，就两小片油菜叶子～	0
4235	中午12点下单，中午2点给打电话说抱歉了！马上就给您配送！我说那好吧，又过了一个小时、给打电话说正在制作中！我说我不要了！退餐吧！等不起了，在等我要饿死了！结果不给退款，愣等把晚饭送来了；还他妈的是凉的	0
4236	吃不饱。。。	0
4237	菜量给的挺足的，很满意，就是墨鱼丸不太好，有股臭味，其他都很好吃。	1
4238	太快了。。。。比我定的时间快了一个小时	1
4239	太慢了！！！等了好久好久	0
4240	炒饭好硬，豆角太老	0
4241	没有给我麻油和醋包，伤心	0
4242	等了一个半小时，都凉了。	0
4243	经常上班定这个喝，好喝，送餐员师傅，可好了。	1
4244	东西弄得太脏了,还难吃	0
4245	这顿饭吃的很纠结，浪费了我的5元优惠卷！	0
4246	八点点的快10点送到的真是耽误了很多事，打电话催了两次彻底服了	0
4247	稍微有点腻'其他还好	1
4248	用大众点评直接订餐50多块，说无法送餐，退款，用百度外卖优惠完29块就送到家了，我啥也不说了，开心啊！	1
4249	送餐那哥们特好	1
4250	灰常好～,经常点～	1
4251	配送员态度太差，送得慢，按正常速度下楼取还一直催，呵呵了？	0
4252	超级快就送到了，谢谢骑士很快，感谢骑士这种天气还在工作！	1
4253	鸡蛋皮还在饭里，鸡肉都没有，就给个鸡爪，真心不好吃	0
4254	很不好吃，不知道为什么	0
4255	买的是金枪鱼的，金枪鱼料特别少，跟在实体店自己买的能差一半，真是特别不满。因为不在实体店就这么糊弄消费者吗？很失望。店员把偷工减料省下来的食材做什么用呢？？	0
4256	咸死了，我真是怀疑厨师的水平！一个多小时才送来，米饭都是冷的！	0
4257	小菜很好吃。	1
4258	味道不错，要是没有优惠，就太不值当了	1
4259	速度有点慢	0
4260	按错了，还没有送到	0
4261	太臭了,真的	0
4262	超级快！二十分钟就到了！味道不错	1
4263	不给我多加点米饭！！！	0
4264	快递是卡着点来的，还有5分钟就半价了，我也是醉了	0
4265	最喜欢麻辣烫了,好吃~~~~~	1
4266	大份的就那么一点，然后价格比在别的饭店单点个菜还贵。	0
4267	很好吃很实惠～但有点不够吃，要是加送点当主食的饼就好了～	1
4268	南瓜露是冰的...冰的！	0
4269	味道不错呀，鸡翅好吃！	1
4270	糟糕,继续努力吧	0
4271	好大一盆点了7个小份量足	1
4272	就是送餐有点慢	0
4273	披萨很好吃,但还是最爱熔化金枪鱼的,送餐师傅辛苦啦	1
4274	7:40下单9:35送到，说好的一个小时呢？等绝望在家泡了面了。。。幸好做的很难吃，可以就是浪费了，牛蛙基本没见着腿儿，牛蛙腿你们留着做别的菜了么？特意备注的不要辣牛蛙你不能单炒也就算了，烤串个比个的辣，厨师你们不看备注的么。。。鸡脆骨不熟，板筋嚼不动，烤大虾肉很松不新鲜，总之不敢再点了，唉。。。	0
4275	不是特别好吃，全是肥肉	0
4276	第一次定,挺好吃的,就是有点慢,可能距离有些远	1
4277	等了几乎两个小时，和预估40分钟未免相差甚远？	0
4278	可乐送到已经洒了一半，都没气儿了，豆腐脑也洒，红油抄手也洒了，哎！！！外送需要再专业一点	0
4279	很好吃,送餐速度也还不错,还送了一个王老吉饮料	1
4280	送餐太差了，大酱汤全撒到袋子里了，沙拉的盒子是坏的！	0
4281	整体不错，肉少，配菜太多。	0
4282	服务态度很好，东西也好吃	0
4283	说了半天不要辣，还是放辣椒了	0
4284	菠萝冻过甜，柠檬冰冻也不太好，但大满贯一如既往的好	1
4285	好吃！就是小贵	1
4286	真是慢啊快两个小时了。。	0
4287	整体还不错,就是太肥了,而且都凉了,送餐态度不好	0
4288	为什么没有饮料！！！！打电话说外卖就没有饮料，那你图片是干嘛用的呢。怎么不写里边说没有，这算欺骗吗?	0
4289	师傅人很好,，送的速度也很快。	1
4290	送餐特别快,态度好,辛苦啦,谢谢	1
4291	剁椒鸡蛋里全是鸡蛋，几乎没有剁椒。	0
4292	第二次订这家的饭，但明显和上次不一样。上次订的很好吃，但这次像剩饭，包装上的地址也不对。	0
4293	这次推荐鸡肉的。但备注了酱汁貌似没给哎、依旧干、幸好赠送了王老吉。	1
4294	很快就送到了，但我的泡菜五花肉饭里面的五花肉去哪里了？	0
4295	不喜欢这个口味儿	0
4296	11:52订的，14:52送到的，差评已经不足以表达我的愤怒了，打电话过去，服务员更牛气，妈的，再也不吃了，透心凉了	0
4297	炸得太狠了！还是不错的	1
4298	非常好吃，而且速度特别快	1
4299	送餐师傅很给力，饭相当难吃	0
4300	速度很快,赞一个快的小哥	1
4301	配送时间稍微晚了几分钟，但没关系，送餐的叔叔人很好，卷饼用锡纸包装，同事还以为是韩国快餐店的紫菜包饭，饼皮很筋斗，香菇鸡肉的夹料也很足，盒饭里面菜少了一些，但味道还不错。一个中号卷饼配一个盒饭，我觉得正好，	1
4302	非常不满意，量少	0
4303	饭菜好吃，环境干净，服务人员态度友好	1
4304	真泥马难吃。没有酱。一星都不想给,送的又慢	0
4305	皮蛋排骨,送成皮蛋瘦肉	0
4306	披萨非常差，感觉像小作坊做的。而且点的蝴蝶虾结果送来的是鸡翅。关键鸡翅应该也是5只装啊，怎么成2只了。	0
4307	速度略慢了	1
4308	强烈投诉！！！！！！！鸡肉都是碎头！！都是！！！！！！！！和第一次定完全不一样！点大份送来的却是一盘散沙！！明显比第一次给的少太多！！！就连米饭都不满，店家你至于吗？！？更可气青笋不到10片还都切的跟芹菜似的～回头客就是被坑！慎重吧！！！！！我是不会再点啦！！！！！坑人啊！！！！！！！	0
4309	很好吃，。送餐准时！！！	1
4310	就是量特别少，味道一般吧。	1
4311	好评给百度的送餐小哥。,但是麻辣香锅实在是.....反正以后不会再点了，特别少而且还不好吃！！！！！	0
4312	等了好久好心塞,味道也不怎么样,卷饼不好吃,粥太淡了,卷饼里还有头发丝	0
4313	很不错的一次,下次还会到这买	1
4314	螺蛳粉还是不错的，绿豆沙也很好喝，但是这送餐速度也太让人无语了吧，不说自己不认识路，还怪我们把地址写错，气人！	0
4315	一份炖肉卖20，小的亮瞎眼	0
4316	大排真是太少少少了……差点以为是猫粮	0
4317	明明卤香鸡腿17元送到后19元，而且鸡腿上有头发。	0
4318	外卖就是送到家啊,有一个小点的男生每次他送就喊到楼下拿。本来五分钟走着都到了今天竟然送了两个小时。	0
4319	白菜豆腐汤就是我想要的味道！西红柿鸡蛋炒面里放了酱油，怪怪的。酸菜鱼片，只有酸菜啊，一份两盒，一盒里就四小片鱼啊！	0
4320	一个卷饼不够，如果买的时候可以再添加买几个卷饼就好了。肉和菜很多。	0
4321	因为饿了所以点的餐厅特别近，就这个还一小时送到。差评	0
4322	太慢！骨肉相连估计总共也就一串，全是洋葱	0
4323	溜肉段都是面粉，地三鲜的油比菜多	0
4324	还没吃，送了一个小时，速度有点慢	1
4325	套餐就够一个人吃了，点多了	1
4326	送餐太慢了。。。等的蛋疼。。。	0
4327	服务态度特别好	1
4328	姜蓉鸡，新菜，味道也不错。	1
4329	面送过来都变成饼，兔腿又做越小。	0
4330	味道好速度快包装严	1
4331	我的妈呀速度太慢了吧拜托下次找一个能找到地方的谢谢	0
4332	感觉没有在店里的好吃，感谢送餐师傅我们家六楼没电梯还得爬楼梯	1
4333	非常好，送得及时	1
4334	十一点定的，快两点送到，中间饿的不行自己去吃了，要求取消订单，老板答应的挺好，实际还是没给取消。真是服了。	0
4335	好快！！！味道不错	1
4336	人很好，菜也不错。很满意	1
4337	筷子都没有	0
4338	饭太少。。	0
4339	单加的青菜里有根头发	0
4340	小哥长得帅态度还好，好评	1
4341	咖啡都不封口了么？！洒的……	0
4342	很棒！太快了	1
4343	好吃，就是饼太油了	0
4344	没收到餐~~11:45分送，13:20还没送来，退了	0
4345	挺好吃的，满意，速度真快	1
4346	不错，希望品质如初！	0
4347	米饭太黏，跟盖饭似的，只不过多了点蔬菜，不好吃。还吃乖乖吃卷饼吧！	0
4348	为什么不给餐具？,洒的到处汤汤水水的	0
4349	超级难吃，简单的家常菜都做不好	0
4350	折扣越来越多少啦	0
4351	味道不错，口味偏甜	1
4352	粥里有头发,就没吃,剩下都好吃	1
4353	连续几天点这家外卖，味道很良心	1
4354	买了很多次，一次比一次少了，送餐时间也慢了。	0
4355	有点腻。没给拿勺子。	0
4356	竟然不给餐具！	0
4357	都说了不要放葱蒜，还有就是到了指定时间还没送到，艹	0
4358	到家进门在百度外卖订餐，一会儿功夫，送货员就送到了热腾腾的饺子，大风下雨的天气，饺子就酒，太美啦	1
4359	疙瘩汤比学校食堂都差，没这么糊弄的！扁豆面，基本都扔了	0
4360	鸡腿卷没有以前好吃了	0
4361	漏了鸡翅,钱没少收	0
4362	好实惠,都吃不完了	1
4363	好吃.很棒！！！！！.服务态度也好	1
4364	定了正一味的辣白菜，18元分量很少，没有米饭，味道一般	0
4365	土豆肉丝很好吃，稍咸，少点盐健康点。,京酱肉丝酱太多了，一般般	1
4366	像是青菜炒肉	0
4367	抄手就是个面疙瘩,量也太少了,下次不买了	0
4368	送餐速度一般一小时左右,等待太漫长啊,味道还不错	0
4369	太难吃了，无法形容！	0
4370	红油抄手送来的时候碗是竖着的。。。不夸张竖着的。。红油汤全在塑料袋里。。。跪了。。。	0
4371	能把人辣死，这是眉州东坡吗！	0
4372	味道不错，出去吹风的时候正好碰上外卖小哥。	1
4373	不爱吃甜口的肘子…尖椒巨给力…	0
4374	谢谢快递哥哥，非常准时，辛苦啦	1
4375	特别慢！！！送餐态度还很差！等了一个多小时，说了一句你们也太慢了吧！人家说那没办法餐厅太忙！卧槽餐厅忙怪我喽，一直说快到了快到了！到不了就到不了我也不用一直在楼下坐着啊！千万别定这家！！！味道还一般！就是便宜	0
4376	太甜了觉得	0
4377	东西不错,又把发票忘了	0
4378	板筋也太少了.一串就四片.一片的边长不到三厘米。	0
4379	味道好，速度快，不错。	1
4380	经常买这家的饺子，味道棒棒哒！	1
4381	一般！也不怎么样	0
4382	味道不错，送餐速度快！很不错大赞	1
4383	好喝。喝到底能吃到紫薯块，甜度适中。	1
4384	非常好吃，经典，必吃！	1
4385	餐厅离我家很近，骑手取餐后却先跑了其他3个小区，导致送餐速度慢，咖啡也凉了。	0
4386	11点31下单,12点51送到。这速度太慢了	0
4387	为什么经常要撒掉！我没次不说，你们就没个完了？！	0
4388	番茄酱没有,鸡块蘸酱也没有给,吸管也没有给,这次差评（︶︿︶）,！	0
4389	下午1点送到的，面都坨了。没有吃	0
4390	太慢了,那么近要一个小时才送来	0
4391	很好吃，量又大！	1
4392	味道不错，饼里面肉可以少点，菜多点！	1
4393	感觉非常不实惠。,拌饭里面的各色菜只有一点点点儿，豆芽可以用几根来数。,只能吃到辣椒酱的味道，吃过正一味多次，口味最差的一次。,一听装可口可乐就是“7元饮料”。,如果不是这次送餐很快，真想给你一星或负星。	0
4394	肉夾馍不错，其它一般。	0
4395	薯条很大很好吃！送餐快！	1
4396	挺失望的，不如想象的好吃	0
4397	要的梅菜扣肉给的猪蹄子,囧	0
4398	挺好的，也很快，好评！	1
4399	不好吃,不好吃,非常不好吃	0
4400	等两个小时多,差点没饿死	1
4401	还可以吧。没有土豆丝的好吃。个人感觉。哈哈	1
4402	送货快，老字号值得信赖。	1
4403	距离600米，送餐2小时，	0
4404	很好,就是送货太慢	1
4405	一个半小时才给我送来，送到包子都凉了。	0
4406	要备注里写的根本没人看得到么……	0
4407	本来怀着期待的心情想体验下，结果收到的咖啡洒了好多，备注着加奶和糖压根没有，哎！真心失望啊！	0
4408	服务态度还不错，但是今天送货速度太慢了，都饿得发晕了。	0
4409	喜欢多年。非常好。	1
4410	不怎么好吃	0
4411	每次送餐都要等一个小时…而且感觉店商根本不看备注	0
4412	没有送筷子，让我手抓啊？	0
4413	他们没用百度的快递，速度就是这里写的时间乘以二！饭店且等吧	0
4414	卷饼很实在，京酱肉丝都是瘦肉。南瓜粥一般。	1
4415	能送这个实在太好了,外送大哥辛苦了	1
4416	我的番茄酱呢！	0
4417	很快,菜分量足,超赞	1
4418	很香,很好吃	1
4419	都不错，配送员很负责	1
4420	服务态度很差，让人等将近两小时也就算了，还少送一样，给打电话送少送了，还说让等下次点时一起送，这么差的态度谁还点下次啊。凉拌米线也很难吃，感觉糊弄的态度，简直一个差字都不足以评价了	0
4421	太难吃了,已经想不到用什么词,来形容难吃了	0
4422	柠檬有一个坏了，南非脐橙剥开都干了	0
4423	从下单到送达用了将近一个半小时，据商家反馈送餐员在路上狂奔了30分钟，从郊区都能到市中心了吧。饭送到都凉了，吃到胃里都是凉的。不会再订了。	0
4424	有一个餐盒裂了,饺子都脏了，这他妈送餐的也不说，让我怎么吃！能不能给逼养的炒了鱿鱼。什么态度,送餐的都这操行，可想而知餐馆了	0
4425	及时更新送餐信息很重要！	0
4426	牛肉烧卖非常好吃，酱油炒饭还有酸辣汤也很好。份量非常足。青城也送外卖太开心了！	1
4427	说了希望多送点泡菜，结果连一点都没看到，	0
4428	这大冷天的辛苦骑士了！谢谢您！饭很好吃！	1
4429	味道不错，价格也可以，但是评价给一星，就是对接线员的服务态度，实在太差了	0
4430	靠。昨天中午的订单我取消了订单的。tmd太慢了。为什么没有退钱给我。我根本没有拿到订单。操。退钱！老板良心做生意啊	0
4431	点的烧烤,特意电话告诉要微微辣,结果还是很辣,尤其是牛板筋,辣的没法吃	0
4432	太慢，正一味订了好几次了就是慢。接不了这么多单，就暂停下啊，太耽误事儿了	0
4433	饭的味道不错，送餐时间过长，所有的面全都坨了！难以下咽	0
4434	凉皮太辣,吃不下都	0
4435	热干面口淡,皮蛋还不错,送货速度很快	1
4436	送得慢咱忍了，卷饼凉透了咱也忍了，尼玛劳资明明点的皮蛋瘦肉粥，是粥是粥是粥，送了个王老吉过来神马意思！！！好吧，就算太忙送错东西也可以理解，尼玛电话打不通，打不通，不通，这TM神马意思！！！到现在解释都没有一个，尼玛劳资现在一颗星也不想给。宇宙卷饼，差到不行，继续多说，影响心情。	0
4437	我10:33下单完成，送达时间是13:22！差11分钟就三个小时！宇宙速度！	0
4438	配送很快，味道一般	0
4439	订单是两份大薯条。就给一袋番茄酱,您能再抠点么？点那么多东西就当一个袋子底下的汉堡已经变形压扁。,配送人员素质偏低。有门铃不会按。大力拍门就像报丧的。	0
4440	酸辣粉就半碗！白菜心吃两口就没了！	0
4441	我同事说1个这么大,怎么吃,而且，图片上的啤酒呢？为什么没有！	0
4442	今天米饭夹生.	0
4443	快递小哥人又专业又好！快到了提前通知，电话很有礼貌很耐心，而且按时送到了	1
4444	昨天草莓汁没有送来，让补结果打了三个电话都没有送来，今天定的草莓汁居然送的是酸梅汁真是无语了	0
4445	觉得很好，味道不会很重很油腻，肯定不是地沟油。	1
4446	都不看备注，说好的辣椒酱也没有放，土豆丝没放盐	0
4447	特别快,感觉定完没几分钟就来了,送餐小哥很细心,赞一个	1
4448	非常快，味道好	1
4449	就是煎饼已经软了	1
4450	包装很好，很快，就是感觉有点少。	1
4451	超过预计时间,太慢,不好吃,有点凉了	0
4452	一个小时四十分钟送来的。。怎么招都是太慢了。问题是电话也基本打不通，希望改进吧	0
4453	煎饼里沙拉酱太多了，齁咸齁咸的……	1
4454	菜品一般般	0
4455	水果沙拉一股子刀味,餐饮做成这样一点都不卫生,不会点它家了	0
4456	味道很好，分量好像比在店吃的少。	0
4457	速度太慢了，都快成夜宵了！	0
4458	凉皮味道还行，别的真不好吃，那个面条一点儿味道也没有，鸡蛋汤也是。	0
4459	时间太不给力了。两个多小时。。。一定要改善。不然没人买了。	0
4460	送餐送了俩小时，饿晕了都，盖饭太难吃了	0
4461	红豆沙喝了几口就拉肚子了	0
4462	师傅送餐神速也！,非常耐心,非常体贴。谢谢！	1
4463	周末八点半的早餐都送成午餐。以后不会再定黄太吉了	0
4464	第一次使用就迟到3个小时，还不免单，才给打7折，为什么饿了么2个小时就主动免单。以后还怎么用百度外卖。	0
4465	送餐很好,吃的一般	0
4466	订的菜没有了，换了个便宜的菜，说了多退少补，结果没把钱给我退回来。诚信很有问题。锅包肉又硬又粘牙，酸的一B。再也不会点这家了。	0
4467	还不错哦~推荐！	1
4468	盐是不要钱吗！！！！！一份餐送两次，也是醉了！	0
4469	味道还好吧	0
4470	葱花饼不好吃	1
4471	很好吃,送餐的很冷	1
4472	下次能送早点就好啦,快饿过劲啦	0
4473	飞速,南瓜粥没了换了皮蛋瘦肉也ok吧	1
4474	好方便，用了代金券比去店里买还划算	1
4475	骑士服务很好，商品质量也可。	1
4476	还有垫纸，非常贴心。	1
4477	我的热饮呢？少送了一个什么时候来	0
4478	味道挺好的，南瓜羹量太少	1
4479	送货挺快，但味道不如以前的好吃了！	0
4480	订的两份米饭都是半盒，打开还以为是吃过的了，装一起也就一盒的量，上次订的菜还挺好的，用的两个盒子装，这次都硬塞到一个盒子里了，打开袋子半袋子汤洒出来，盒子外面都是油，一看都没有食欲	0
4481	还好吧就是肉切的有点大饼不是太好如果是厚面烙饼会好很多，	1
4482	超时半个小时，还送错东西，并且还少了两杯豆浆，最后打了十几次客服电话竟然一直没人接,呵呵	0
4483	东西很好吃,送餐速度和态度也很棒	1
4484	商务十点半左右定的餐，到下午两点了还没送到。打电话取消订单了，为什么是“订单已完成”而且没退钱？	0
4485	订了个京酱肉丝，送来个鱼香肉丝	1
4486	要了两份米饭，只给了一盒。,一份菜是侧着放的，菜汤流了一桌子。	0
4487	12点50订的餐，14点50送到。披萨凉的透透的，怎么吃啊？	0
4488	订的12：00送餐，12：50才送到，上班族中午时间有限，请商家以后工作再细心一点。红烧牛肉套餐土豆多可以理解，但牛肉太老了嚼不动，请改进。米饭量挺多的值得表扬。	0
4489	扁豆焖面超级干！排骨分量超级少，一块就一口的大小。太不值了！！！	0
4490	太慢，太慢，实在太慢。而且也不好吃。	0
4491	腐竹烧肉跟肥肠调味偏酸，量挺足	0
4492	送餐小哥到的时候连呼哧带喘的，难道是跑着来的？还好吧。不过送餐真心不应该点面条之类的，幸亏还是点的炒面，也坨了	0
4493	非常好，夏天正合适	1
4494	送餐时间特别长，2个多小时。。。自己想吧	0
4495	多收了钱。	0
4496	鸭子只有一小盒肉，就没收到过肉这么少的烤鸭，半只烤鸭我信，一只我真不信！	0
4497	配送员送货及时，糕点质量好	1
4498	感觉还不错！配送很及时！刚刚好下班点送到！	1
4499	羊肉泡馍没有了，换了卤肉饭，差价7块，只给了我5块	0
