6392	难吃，而且要的酱香的，来的是辣的，味道还难吃，真觉得是假的拿度	0
6393	份量变少了，味道也不如从前了	0
6394	今天送得实在比较慢，送到全都凉了…所以豆角整个粘巴巴，而且也超级咸。肉还好，没有很肥～	0
6395	酸辣土豆丝为何放那么多生姜！	0
6396	晚上到家，累得不想动，能吃上热乎乎的饺子，赞，配送员热情的服务，必须赞	1
6397	两种口味的饺子给我掺在一起放的！两个盒子不应该一个盒一个口味吗？！	0
6398	配送速度很快，买来作为早点还挺好。	1
6399	每次肯定晚至少一个小时，下单了最后没送到，真是醉了，饭也给的死少。不建议大家订餐，如果非要吃，最后提前一天订，第二天再吃	0
6400	慢就一个字，最好提前两天点餐。当天点的是不要奢望能当天送达的！	0
6401	量足，味道不错，就是速度慢点	1
6402	卷还不错，但粥就太一般了，皮蛋粥感觉就是早就煮好的稀粥里临时加了几块皮蛋。	0
6403	支付宝最好用了，支持支付宝	1
6404	差差差，不到十一点定的，十二点半才到，整整脱了一个多小时。打电话说到楼下了，三十分钟也没上来，爬楼梯也十几分钟到了吧，	0
6405	真棒，,这速度，,送餐在疯狂奔跑中,跑了俩小时。	0
6406	农家小炒肉,有一点辣了。	1
6407	牛肉嚼不烂，肉比较死，豆芽水煮一样，说实话真的很一般！说的事实！	0
6408	配送人员很有素质,就是菜品太一般,宫爆鸡丁儿太甜了	0
6409	送货速度快，服务不错。就是饭比较难吃	0
6410	换菜了，说不放辣还放，什么意思	0
6411	个大量足，吃了很撑，太给力了，还会再来！	1
6412	没送,直接关单	0
6413	卷饼很好吃，肉超多~香菇鸡肉咸了点，下回尝尝其他菜吧，总体上是不错滴。	1
6414	这是什么鬼！！！石锅拌饭说好的蔬菜呢？一根胡萝卜丝，一块蘑菇么？再也不定了！！	0
6415	每种口味都喜欢	1
6416	太差了，尤其是送餐员态度！不会在来了，全各位慎重，态度也就不说了，里面的粥都撒了，我就呵呵了	0
6417	很快就送到了，20分钟，很不错的，南瓜粥很好喝，谢谢~	1
6418	哎。。。完全没法评价这个送餐速度。。。竟然送了104分钟，我真是醉了。。一个小时的时候跟我说送出来了。。然后过了44分钟才到。。有这么欺骗消费者的么。。你说人太多就算了。我订其他家的。。真是过分啊！,而且之前一次也是送了1个小时14分钟，再也不定这家了。。太垃圾了	0
6419	点的俩菜都不好吃,还挺贵一共96	0
6420	时间太慢,没胃口	0
6421	又快又好又便宜！真心给力！！！	1
6422	挺快，饭一般，全是油	0
6423	送来饺子全粘了，破的一塌糊涂	0
6424	午餐高峰时段速度很快！	1
6425	服务很好,好吃,送餐快	1
6426	煎饼真唑实，一个就撑。吃的拉面煎饼	1
6427	太差了，订单要求15：30送，可是13：30就送来了，投诉还无用	0
6428	勺子碎了。这次时间有点长。	0
6429	搜锅包肉，这家卖出份数最多，所以选择了这家，可太失望了，面裹的比肉厚很多，基本里面没有肉，一份锅包肉两盒装，能有一两肉就不错了。糖醋味也不浓，重度怀疑出售数量造假，	0
6430	还可以,就没给带发票	0
6431	送餐员很热情，很好吃谢谢	1
6432	和店家推广时的包装不一样。包装差评差评差评,送来的时候洒了好多	0
6433	神速,惊呆啦	1
6434	送餐太慢，等了近两个小时！包装不错，味道需要改进，点的全蔬菜饼，蔬菜熟太过了	0
6435	1：菜品打包后明显比店里吃差好多,2：汤在送达时撒了一半,3：送餐员态度非常不好，首先迟到了没有道歉的意思，菜送少了也觉得很理所应当，我们说少送的要不回去拿，要不减钱，结果人家送餐员同志说没好气的让我们都退了，大哥我们目的是吃饭好么，送晚送少都是你的问题，不但不道歉还要让我们都退了，饿死我们吗？这样的送餐员教育一下吧，不然会得罪很多顾客的。,总之，本次很不满意。	0
6436	还可以啦,送餐时间一个小时，饭菜有点凉了。。量对女生来说差不多了。	0
6437	送餐速度快到令人吃惊,10分钟！！！	1
6438	披萨不是太好吃	0
6439	没给我开发票。。呜呜	0
6440	等了快两小时才到。。。	0
6441	蘑菇和南瓜太少了,薄脆煎饼一个不够吃	1
6442	百度骑士态度很好，一句祝福的话心里很暖！饭菜味道也不错哟！	1
6443	送错了。我点的是韭菜鸡蛋，送来的是白菜鸡蛋？还没有醋。	0
6444	面不够劲道，煮时间偏长？	0
6445	味道一般。不出彩	0
6446	菜量越来越少，小炒香干大概占了盒子1/4的容量吧。,速度慢，送到时饭都冷了	0
6447	稍微晚了一点。两个菜正好我们三个人吃，米饭的量还挺大的。味道还不错，就是鱼香肉丝里姜放的太多了有点辣	1
6448	送餐人服务态度很好,很朴实	1
6449	肉松送成鸡柳了，赚到了	1
6450	服务很差，送餐速度超慢，打电话去催，连基本的诚信都做不到，跟你说的和实际的完全不一致。	0
6451	额。。。很难吃	0
6452	送餐时间太长，饭太一般了，汤是调料冲的	0
6453	哎，要的不辣的，结果送来的超辣	0
6454	辣,不好吃	0
6455	卷饼不油腻很健康	1
6456	1，时间太久了。八十多分钟才送达。,2，我拿到后开吃，是冷的。面饼冷下来，口感很差，里边卷的馅料是什么飘香肘子卷（套餐），不说飘香了，一粒粒冷猪肉直往下掉。,3，我勒个去。第一次点，上了个当。	0
6457	自己看错地址，还打电话来气急败坏的说我搞错了，顾客怎么都跟孙子似的。	0
6458	还行吧，份量挺大，就是煎饼里的油条都蔫了。整个煎饼被挤成了一坨…	0
6459	维生素冒牌货配送还好	0
6460	很好！份量很足，香干回锅肉里的萝卜干很好吃，每份饭还送了咖啡，谢谢！	1
6461	定外卖肯定是为了方便,但1个半小时才送到是什么情况,高峰点写着提前1个小时,我提前1个多小时订餐,要是远能早点出来吗,也没超出写的送餐区域吧,要不您就只送附近那一片	0
6462	送餐速度还可以，就是没有番茄酱！！！！！！！！,没有甜辣酱！！！！,没有餐巾纸！！！！！卖家能不能上点心，真是不负责任，差评！！！！！！	0
6463	快速的送到了顾客的手里。	1
6464	好久，我都快把这外卖给忘了，送餐员来了还在这等着我给钱，虽然我已经在网上给过了	0
6465	宫爆鸡丁真的很一般、溜肝尖油放的超多！外卖服务超级坑人、前一秒说满30减8、后一秒又说网络系统显示错误、百度外卖、这次真的很坑人举动、反正下次不再光顾这家店了……	0
6466	奶茶送到有点凉了，披萨好吃	1
6467	配送员很好，很快，还帮我要咸菜。我得了肠胃炎，只能喝粥吃咸菜，订餐时备注了想要点咸菜。后来配送员跟我说他管商家要了，但商家不想给。注意是“不想给”,而不是“没有”。于是我就索然无味的喝了两碗粥。千方固元粥感觉米特硬，可能没熟。小米粥还行，但因为先喝了固元粥，小米粥的香也体现不出来了……	0
6468	鸭头用的袋子居然还收包装费，速度太慢，打了两个电话还没找到，最后下楼自己取得	0
6469	送餐时间上太差劲	0
6470	垃圾，接单配送慢的要死	0
6471	送餐人和餐厅之间应有协调。送餐人十五分钟内取不了餐，餐厅就先別准备。这次订餐系统显示送餐人员19：36赶往餐厅取餐，实际20：42才到达，送到我家的面条、卤肉饭、肉加馍都是凉的。	0
6472	难吃,肉又硬又腻,吃的恶心,差评	0
6473	送的早到了半个小时，味道很棒	1
6474	一打开蛋糕，都变形了，一看就是摔了	0
6475	菜品质量先不说，还没吃。十一点零六下单，十二点四十收到，外卖师傅说，单太多，知道吧？真牛，我是不是还得给你磕个头说谢谢你排除万难送到啊，百度外卖投诉真心打不通，行，到这吧	0
6476	菜品一般。快递不错！	1
6477	送餐时间太长了。而且我要求多带番茄酱，结果只给我拿了一小包，完全无视我的要求。	0
6478	很好吃，菜品味道很好，有要求都很爽快满足，赞	1
6479	大过年的啥也不说了，18点10分下单，20点20送到家，1公里多的路，菜全都冰凉，羊棒骨不给吸管怎么吃？以后再也不叫他家外卖！！	0
6480	我就不明白了~备注里写的清清楚楚~是不认识字~还是不放辣椒不会做？就吃了一口就给家里老人辣着了~妈的~脑残么	0
6481	速度很快，奶茶也都封口了就不会撒出来	1
6482	几颗咸菜,呵呵了。	0
6483	粥没有给勺子，，点的大份但是送成中份了，已和卖家协商好。	1
6484	黄太吉纯他妈扯淡，定个饭一个多小时没送，打了两次400，前后说法都矛盾，要是送不了就诚实点说，不用骗，直接拉黑黄太吉加牛炖，太你妈孙子了	0
6485	非常不满意。因为时间上写的是四十分钟送到,我才定的他家。结果快九十分钟才送来,而且餐都是凉的了。以后不会在定他家了,非常不满意	0
6486	不错，好吃，两个人没吃完，还会光顾！	1
6487	为什么麻辣子鸡要和宫保鸡丁搭配。。。全是鸡肉。。。	0
6488	特别好的师傅，冒雨还送得非常快，感谢百度外卖的送货师傅们。	1
6489	味道很好也很负责	1
6490	好吃，送餐快！	1
6491	米饭好少啊！对我这女生来说也不太够哪！,水煮牛肉还是很好吃哦！	1
6492	红豆布丁奶茶太甜。烤珍珠一直美味	1
6493	吃过两次，两次居然都拉！肚！子！连拉带吐！要不是没时间和他们计较，早就去卫生部门投诉去了！太特么坑爹了！	0
6494	就是太辣了，建议有辣的标明一下，或者反映在商品名称中。	0
6495	送到全凉了，从下单到送达一小时，整整一小时！	0
6496	不要奥尔良啊，不要奥尔良啊	0
6497	用了两个半小时太过分了	0
6498	蛮好，面稍微有点硬。	1
6499	非常好！送货非常快！比美团和饿了吗好多了，以后就在这买了！	1
6500	服务和味道都是不错的	1
6501	一般吧，还可以	0
6502	给商家打电话直接问怎么没减5元,说不归他们管,直接给我挂了，，之后再打根本就不接，，什么玩意！！！什么服务态度！！！！	0
6503	外卖的菜品质量实在无法接受	0
6504	第一次在这家订，也是最后一次，两个小时才送到，呵呵	0
6505	特别慢,东西一般,没有餐具和番茄酱	0
6506	一个半小时才到,太慢了	0
6507	送的超级快~~~京酱肉丝卷好好吃	1
6508	速度太慢,不要了	0
6509	西葫芦锅贴不错,清爽,粥类一般,黑芝麻糯米粥的黑芝麻不好吃,皮蛋瘦肉粥肉太柴	0
6510	不错好吃，就是最后有点油	1
6511	南京盐水鸭不错，鲜肉小笼汤包皮薄很好。	1
6512	强烈建议别买	0
6513	送到了以后,抄手都烂了,都是皮了,坨成一疙瘩,根本弄不开	0
6514	口味不错，很快。很热	0
6515	系统bug，我把地址修改了，配送员收到的地址还是原来的，幸亏黄太吉送餐小哥辛苦又给送过来，赞一个！,餐很不错，豆腐脑很好吃！	1
6516	现在的量明显比以前少。不实在了。	0
6517	时间太特妈的不准时了	0
6518	鲜肉小笼汤包很腻，不好吃。皮蛋瘦肉粥还不错。	0
6519	20元套餐送来的时候都洒了，有一个明显滥竽充数	0
6520	包装挺好，土豆肉丝卷饼中的肉丝都是肥的，不好吃，土豆丝也一般	0
6521	除了碰上店家没电等了一个多小时,其他都不错，菜品可很好	0
6522	十点半定的立即送餐，两点多才给送来！真是够了！打电话还不接，好不容易通了一次，再打就关机！定了这么多次百度外卖，就没碰到过这样的商家，真是长见识了！！！	0
6523	说12点51预计送达，然后12点55电话说，没材料了，做不了。。TM这是在开玩笑么。。虽然最后换了别的，但总觉得不爽。。	0
6524	等了132分钟	0
6525	给同事订的，还行吧	1
6526	送货时间太长！！！	0
6527	东西有点硬，不及别的地方吃的松软	1
6528	定很多次啦！菜很好吃！也很及时！	1
6529	好服务，就是习惯百度外卖的快速	1
6530	等了2个多小时，打电话取消了两次，后来又送来了，真是无语了！饼是粘的，不好吃	0
6531	很不错，速度挺快，就是油有点大	1
6532	一如既往的的快，好吃。。。。真棒	1
6533	送错了，送成盖饭了。。	0
6534	非常不错，值得推荐	1
6535	确实不错，肘子比鸡肉好吃，中号就够了，量足！	1
6536	等超时好多，也没给发票。	0
6537	等了一小时结果送错了，因为要求重新送一份所以又等了十多分钟，而且真的不好吃！	0
6538	第二次点了，量大，很不错	1
6539	味道还可以。	1
6540	米饭有点馊了，红烧肉也不好吃，差评	0
6541	很一般,送到家凉了	0
6542	居然在密封的一次性筷子纸巾上有三只死蚂蚁，怎么弄的，恶心死了	0
6543	口味还可以，就是送餐太慢。离着挺近的，结果等了1个多小时。	0
6544	预定是12:30送到，将近一点才送到也就算了吧，外送员的态度还很差，闺蜜脾气不好差点跟他吵了起来。外送差也就算了吧，点的是海鲜焗饭却送来了海鲜面，我也是醉了，大厨是不识字还是怎么的，弄错不是一次两次了。去年还没有这么差劲的服务，彻底失望了	0
6545	送到都凉了，味道一般	0
6546	买了个王老吉，生产日期是2014年8月份的，僵尸饮料吗？	0
6547	涨价拉、就不想吃拉	0
6548	炒米饭那叫一个粘，而且闷的没法吃！	0
6549	还可以。拌面有点干，油多了。	1
6550	生生把中午饭送到了下午，将近2个小时，而且不止一两次，每次给机会，每次都如此，走路过去不到十分钟的事！等电梯的2分钟都要打电话催，一碗汤不如叫一口汤好了。差评，以后再也不订了。	0
6551	店家和送餐的人特别不好，送错地址了还赖我写的不清楚	0
6552	最难吃的外卖之一	0
6553	等收到的时候，卤煮是温的，饼是凉的。速度慢。	1
6554	家里人说有股臭臭的味道~	0
6555	味道很好，服务也挺好，就是我下单了四块猪手，送来的只有三块，那一块哪去了？	0
6556	土豆肉丝比土豆丝卷好吃,因为辣一些	1
6557	都很好，还有优惠的	1
6558	2点才送来！！	0
6559	天气不好,非常感谢,还是热的,好评！	1
6560	天气恶劣而且服务态度很好，谢谢	1
6561	等了137分钟，也不知道是不是想让我吃晚饭，公司同事都在工作，就我在吃饭，老板看我的眼神都那样……	0
6562	味道一般吧，菜给的少，送的时间太长了，包装到是不错	0
6563	饼还好，就是送餐速度太慢了～	0
6564	泡菜汤外送的量太少了	0
6565	卷饼里一个钢丝，希望卖家能注意，生意好了，要更细心才是	0
6566	太难吃了。尤其是土豆丝，难以下咽。尖椒炒鸡蛋都是汤，简直就是尖椒炖鸡蛋	0
6567	味道还可以，快递很快。	1
6568	菜品及包装看起来不错，吃起来也还好，但是吃完之后总是拉肚子，怀疑不太干净。	0
6569	差评，送过来晚不说，扯面已经成浆糊了，面条一个小时前做好了没有人送黏了。建议后续商家做饭前和送外卖的提前商量好，再做。保证饭菜质量	0
6570	披萨很好，但是希望电话通知	0
6571	送餐当天下雨、4点订餐、要求起点送到、最后居然9点才到、中间打电话是送餐员出了事故、但是没有新的派送员送餐、也没有人和我们联系！！	0
6572	服务好速度快，100分	1
6573	很好，百度骑士师傅很好，很快速的送到，大赞	1
6574	太慢，晚了四十多分钟	0
6575	烧茄子，怎么还有青椒和西红柿	0
6576	点餐之后。打来电话。这个菜没有了。那个没材料了的。什么都没有。你还开着个什么劲儿。,披萨送来都凉了。难吃到爆	0
6577	太慢了，昨天港丽只用了39分，你们今天用了快两个小时！！！！	0
6578	您的意见很重要！口味如何？服务怎样？来点评一下吧！	0
6579	鸡蛋沙拉没有沙拉，脆皮香蕉有点油。快递员忘记拿发票了，不高兴。	0
6580	给麻麻点的，她吃不习惯。	0
6581	单子竟然被转派了，,联系标注了电话的送餐员很不负责。,后来送餐来的人态度很好，,虽然迟到了很久，但是解释了原因。	0
6582	量很少。送餐二逼	0
6583	等了一个半小时，皮蛋瘦肉粥太失望了，卷饼味道一般。	0
6584	准时！百度骑士辛苦！菜不错！美味！	1
6585	我从11点半订餐，你妈的下午一点四十才送到！！等了俩小时！！再你妈也不定了！！	0
6586	西安的魏家凉皮。。。才不是这个样子！！	0
6587	口感不错，很好	1
6588	盖饭很有诚意，米饭压的特别瓷实！味道也不错！	1
6589	我能说可以退餐吗？这个是饭吗？谁吃谁上当啊！？！质量太差了！！	0
6590	米饭给的不够整盒！半盒都不到！真够孙子的！烤鸭到了以后都没法吃了！唔得太严了！劝大家以后别点了～	0
6591	瞬间就送到了，冬天吃外卖好温馨	1
6592	味道很好，吃起来也方便～	1
6593	不错，很快	1
6594	等了一个半小时，我觉得我脾气还算好的吧？都没有骂街，只催了一次单，是不是因为我已经付款了？	0
6595	价格实惠，值得购买。	1
6596	都备注那么清楚，,还是发票也不拿，吸管也不拿，让人怎么喝啊,已经几次了,实在失望	0
6597	快递员服务非常好,食品也不错	1
6598	不好吃,太腻了,饼还很厚,皮蛋粥就是白粥,等了一个多小时	0
6599	要的红烧肉，送来却是鸡排，早不说，等送到了再告诉你！这是赤裸裸的欺骗啊！	0
6600	如果是辣的应该标明，牛肉蔬菜卷快辣死我了	0
6601	味道很好的，就是今天店家太不小心，菜品送错了，还有面里都没加花生，唉	1
6602	从来没有吃过	0
6603	味道就那样把,盖浇饭挺难吃的	0
6604	2分12元的菜一点点，9元的就就是易拉罐	0
6605	送来的时候菜都凉了，在超时的临界点送来的，好好的热汤都变凉了	0
6606	大哥，你知道你送的这是披萨吗？拖成一坨让我怎么吃？	0
6607	一般。名不副实。不会再订了。	0
6608	本单实际送达时长为39分钟,瞎扯我等了1小时30分钟呢	0
6609	有点凉，吃到几口有淡淡糊味的，其他的都很好。	1
6610	送餐时间太慢	0
6611	还不错，说好的11点30送，真的是哦，很准时	0
6612	味道不错～优惠力度好大	1
6613	不错，方便，挺好吃的	1
6614	差评差评差评！送了三个小时才送到，好意思吗？10点13分点的餐，13点13分送到，搞活动订单多我知道，但总得有个先来后到吧？以后不可能在这家定餐了！	0
6615	饭菜质量一般般，可选的饮料种类也少	0
6616	送餐大哥送到门口态度很好～	1
6617	说实话嘛，真的比较失望，芝士年糕我以为是外面卖的那种，年糕里面裹着芝士，但其实只是普通年糕放在芝士酱里。其他菜品就不一一点评了吧，觉得不值这个价钱。	0
6618	已支付订单，等待1小时打电话催单后，商家再（给“本机”）打电话询问，说是没订外卖，呵呵，还说没打错电话。好智能的机器。2小时的外卖，呵呵，外卖小哥还不耐烦催了。	0
6619	还可以就是有点辣	0
6620	难吃,而且很慢	0
6621	从订餐到送餐送3个多小时,一帮人饿的晕头转向,大酱汤洒得一干二净,送餐的师傅找不到楼单元门,还不带零钱,饭菜味道也一般,再也不会订了!!!	0
6622	排骨只有三块！两道菜都好苦！	0
6623	口味还行。	0
6624	送餐等了快两个小时还没到，十点多定的，十二点四五十了还没拿到饭，我只有在别家又定了一份，都比你早到	0
6625	送餐有点慢	1
6626	妈逼了！点餐不管饭的？光吃菜？醉了！真的知道怎么想的！幸好骑士小哥人好、又给送了一份！	0
6627	牛肉有点味道	0
6628	终于赶在半价以前把晚餐送来了，实在是“感谢”！饭盒一看就是装盖饭的尺寸，如果是这样就不必多花那几块钱。菜的颜色早已不新鲜，看来是吃了中午的剩菜。除了快递员还知道有些不好意思外，实在没有什么可值得称赞的，放了勾芡这些已然没必要再提了。	0
6629	面时间太长了，坨了，不好吃了	0
6630	口味一般，感觉不是肘子肉	0
6631	速度很快，下雪天辛苦了。	1
6632	送餐员辛苦，奶茶好喝…	1
6633	没有以前好吃了，只剩干净卫生	0
6634	送餐太慢了！！！！！	1
6635	可惜不能更改杯型，又所有订单也不齐全	1
6636	买过这么多外卖第一次让我去楼下取的！还显得特别理所应当！一颗星给你都多！！！	0
6637	如果饼薄一些，加点辣酱或者麻酱会更好吃！	0
6638	等了整整一个小时，都凉透了。变得好难吃	0
6639	说实话，中份吃不饱，得2个	1
6640	汤汤水水的，里面啥乱七八糟的都有。还有一个烧烤的啥呢？！	0
6641	味道还可以，主要是省事，送餐小哥不错，非常速度	1
6642	菜品温度差,菜品味道佳	0
6643	忘给筷子了…	0
6644	麻将怎么没有味道，不太好吃	0
6645	配送太慢了！没拿到餐就在楼下确认订单了	0
6646	四季豆不干，外卖很快	1
6647	电话根本打不通只能死等。。。。	0
6648	等了一个半小时餐才到，餐都完全凉了。菜也很油。商家电话永远打不通。不会再点了。	0
6649	不如第一次好吃了呢	0
6650	吃到了不说,饺子拿上来就是冰的！！！完全冰冰凉！	0
6651	送餐小哥辛苦了，大冷天的	1
6652	好难吃啊，鸡块的油味道好大，面坨了，很难吃，就把煎蛋吃了，其他都扔了	0
6653	打死卖盐的了，叫了两盒米饭，菜都没吃完，再也不能吃他家菜了，差评	0
6654	孩子非常喜欢，尤其是草莓甜饼还会再来	1
6655	还行吧，素炒饼咸了，什锦炒饭淡了，醋溜木须油大了	1
6656	超级慢,等待了107分钟,我吃着都会胃疼,饿过头了..,送餐员电话也不对	0
6657	不能再凉了,我点了不要辣，辣辣的青椒会不会太多了…哭昏	0
6658	漏了，漏了，漏了	0
6659	外卖小哥人非常好！当然味道也很不错，推推推！	1
6660	特别差,少送一个大酱汤,一个小菜,饮料还是洒的！无法给予评价！等再补送过来其他的全凉了！	0
6661	送餐难倒是黑社会老大？太牛逼了	0
6662	还不错,就是一盘京将肉丝	1
6663	油泼面没熟，都是粘的，坨一大疙瘩了。	0
6664	3个小时……	1
6665	很好吃，就是量少了一点，男生可能吃不饱	1
6666	这个不好吃,吃的好难过	1
6667	时间太长，并且泡菜汤没有米饭	0
6668	不知道黄家是没有薄脆的。。不爱吃，,肉松的不错	1
6669	送餐可能没有看我标记的送餐时间，提前送来了，飘香肘子的很好吃	1
6670	送餐差不多迟到1个小时，点的是面，味道可想而知了	0
6671	没什么味道！	0
6672	菜是凉的。11点10分下单，13点才送到。	0
6673	回锅肉分量很足！很不错！	1
6674	别的百度骑士都给送上楼,这个没有给送到楼上,没有就算了,态度也一般,就这样吧,粉吃起来的味道还是可以的,气味稍微有一点怪。。而且并没有见到螺丝,有点失望	0
6675	奥尔良烤翅中直接是夹生的，完全没法吃的节奏⋯⋯其他很赞。强烈推荐芝士土豆球和五花肉石锅拌饭！	1
6676	量少的可怜！味道也不怎样。集体说以后可以不考虑吃	0
6677	给我配错了，中午的饭，等到晚上才给我解决，中间打了4次电话投诉都无效，差	0
6678	东西少，送餐慢	0
6679	东西要什么没什么，	0
6680	很好吃,超值	1
6681	我只能说，皇太吉太不要脸了，7点下单，8点50送到。还自己确认物流在7点40送达。奇差无比	0
6682	总体来说还不错，就是煎饼时间长了有点软，没那么好吃了	1
6683	说了送发票，一直没送，有这样的吗？以后再也不订了	0
6684	送餐太慢，没有给我打5折	0
6685	很快，很好吃，就是优惠力度再大点就好了，或者价格在便宜点	1
6686	商品一般吧	0
6687	真没传说中的那么好吃，也可能是因为我点的是猪肘卷饼的缘故吧。反正菜太少了，肉太多了，尤其是好多肥肉处理的不太好，吃起来腻死了。如果肥肉部分去腻就好了。	1
6688	离学校近,很方便	1
6689	11.30定餐，1.00送到，中有打了4次电话催，生气。。。永不再来。	0
6690	太慢了，不过挺好吃，还有就是我拿错别人的了，亏了我5毛钱	0
6691	太快了，都不饿了。	0
